tcpdump -i eth0 tcp

tcpdump -i eth0 tcp
tcpdump: verbose output suppressed, use -v or -vv for full protocol decode
listening on eth0, link-type EN10MB (Ethernet), capture size 262144 bytes
21:27:08.304276 IP lamp-ubuntu-s-1vcpu-1gb-tor1-01.ssh > cpec09435f2355f-cmc09435f2355d.cpe.net.cable.rogers.com.57921: Flags [P.], seq 1337437858:1337437894, ack 2988421572, win 501, options [nop,nop,TS val 2657846469 ecr 1671135023], length 36
21:27:08.306437 IP lamp-ubuntu-s-1vcpu-1gb-tor1-01.ssh > cpec09435f2355f-cmc09435f2355d.cpe.net.cable.rogers.com.57921: Flags [P.], seq 36:144, ack 1, win 501, options [nop,nop,TS val 2657846472 ecr 1671135023], length 108
21:27:08.306512 IP lamp-ubuntu-s-1vcpu-1gb-tor1-01.ssh > cpec09435f2355f-cmc09435f2355d.cpe.net.cable.rogers.com.57921: Flags [P.], seq 144:180, ack 1, win 501, options [nop,nop,TS val 2657846472 ecr 1671135023], length 36

